job_title,job_location,company_name,job_summary,post_date,extract_date,job_salary,posting_url,description_text,keywords
"Senior Software Engineer, Application Backend","Nashua, NH",Episerver,"Identify when to replace and when to rebuild legacy systems.
Design and enhance all systems to be Enterprise Class (Reliability, Scalability, Performance,…",6 days ago,2020-11-09,,http://www.indeed.com/rc/clk?jk=f30dd5dda51f35b6&fccid=33cb3d5d606b6d6b&vjs=3,"Experimentation is the foundation of all human knowledge. As we continue to enhance our enterprise-class Digital Experience Platform, we are looking for a Senior Software Engineer, Application Backend to help lead and create our next wave of services and architectural improvements. We want you to be idealistic but pragmatic, creative but able to embrace elegant simplicity in both code and infrastructure. Scale and performance are part of everything we build. You’ll be building the foundation that empowers billions of experiences across the world’s leading websites and digital experience providers.. . As a Senior Software Engineer, Application Backend you will:. Design and implement next generation core application backend components. Identify when to replace and when to rebuild legacy systems. Design and enhance all systems to be Enterprise Class (Reliability, Scalability, Performance, Security, etc.). Design and build systems that have monitoring and alerting capabilities. Educate internal customers on how to best venture into our codebase. Organize, plan, and lead large projects through to completion. . About you:. You have 5+ years’ experience in scalable technical projects. You have demonstrated experience in deconstructing a monolith application into services. You have demonstrated experience in designing and building high-performance, highly available and scalable services/APIs. You find satisfaction in being a force multiplier for your colleagues. You look at engineering problems holistically and have developed best in class products. You stay on top of technical trends and know how to use them pragmatically. You are self-motivated, yet still enjoy working in partnership across an organization. . About us:. Work with colleagues that get you fired up every day and are super smart!. Learn more about our engineering organization by visiting our blog. We’re engaged in the Developer Community. We are after-all not just developers but we are also building products for developers. You’ll see us at various Meetups, such as PyBay (Bay Area), Python (Austin) and more. We’re not locked into a specific technology stack. You’ll be working with and picking the latest technologies to do the job right. Some of the technologies we work with include: Python, Django, Celery, Postgres, Redis, Elasticsearch, Docker, Jenkins, Linux, CircleCI, Heroku, AWS, Google Cloud Platform, Monitoring, and observability tooling","['scalable technical projects', 'engineering problems holistically', 'senior software engineer', 'embrace elegant simplicity', 'educate internal customers', 'specific technology stack', 'digital experience providers', 'google cloud platform', 'yet still enjoy working', 'enterprise-class digital experience platform']"
Software Engineer,"Nashua, NH",Arista Networks,"Software engineers work on the whole development process, including:
Writing the code (of course).
Hack on our engineering tools, including p4, django, python,…",30+ days ago,2020-11-09,,http://www.indeed.com/rc/clk?jk=f0360af91a018be9&fccid=da9c8368867819c9&vjs=3,"Company Description. . null. . Job Description. . The core responsibility is to deliver product features. A major part of this is writing the code that drives our products. But the role of a software engineer is much bigger than just being a coding machine. Software engineers work on the whole development process, including:. deciding what features to build. driving the design. writing the code (of course). pushing testing. documenting the feature. supporting customers in the field. Along the way, you might:. extend and improve the test infrastructure. hack on our engineering tools, including p4, django, python, rpm, .... work with sales and business development. improve the content on our website. The Person:. If you.... love to program. enjoy building things and shipping them, truly making them work. find satisfaction in creating a really well-written piece of code. care about keeping the code maintainable and preserving its integrity. look for a better way, and strive to make it real. care about the business too. enjoy working with others who feel the same. learn how things work, just for fun or out of curiosity. ... then this job is for you.. . Qualifications. . A strong background in Linux, C++, TCP/IP, python, hardware, drivers, compilers, or assembly language is a plus. A BSCS/CE degree is required.. Additional Information. . All your information will be kept confidential according to EEO guidelines.","['things work', 'software engineer', 'enjoy working', 'software engineers work', 'deliver product features', 'enjoy building things', 'whole development process', 'bscs/ce degree', 'kept confidential according', 'really well-written piece']"
CNSATM Software Engineer,"Nashua, NH",DCS Corp,"Develop software following Agile processes.
Translate operator functionality requirements into a software system specification.",12 days ago,2020-11-09,,http://www.indeed.com/rc/clk?jk=92ffe96d91839b8b&fccid=1380d0d61a54c0c0&vjs=3,"Develop and improve software components that support mission planning for CNS/ATM certified aircraft.. . Essential Job Functions:. . Performs tasks with little to no guidance.. . Assure software compliance with CNS/ATM Performance Based Navigation and Mission Planning requirements.. . Translate operator functionality requirements into a software system specification.. . Review and update conceptual requirements, system specification documents, hardware and software interface requirements, and software designs to ensure compliance with functional requirements.. . Utilize principles of systems engineering, and other engineering disciplines, to evaluate and recommend software solutions, and clarify requirements.. . Develop software following Agile processes.. . Required Skills:. . Due to the sensitivity of customer related requirements, U.S. Citizenship is required.. . Bachelor's Degree in software engineering or related discipline and a minimum of 5 years of experience.. . Active Secret Security Clearance.. . At least 5 years of experience applying DO-200 requirements to ground station software development or applying DO-178 requirements to aircraft software development.. . Thorough understanding of DAFIF format, content, and relationship to commercial navigation database standards.. . Understanding of Federal Aviation Regulations and CNS/ATM requirements.. . Familiarity with DoD and NAVAIR acquisition processes and Systems Engineering Technical Reviews.. . Strong communication skills, attention to detail, experienced team member, ability to work closely with multiple diverse teams simultaneously, and the drive to contribute to program success.. . Ability to work independently, or in a multi-discipline team.. . Desire and ability to leverage lessons learned by evaluating processes and solutions/conclusions from previous efforts.. . Desired Skills:. . Intimate knowledge of DAFIF specification, ARINC 424 specifications, and other commercial navigation database formats.. . Experience with SQL, Microsoft Access, and database building and manipulations.. . Experience with one or more object-oriented, high order software language.","['ground station software development', 'translate operator functionality requirements', 'high order software language', 'cns/atm certified aircraft', 'commercial navigation database standards', 'commercial navigation database formats', 'active secret security clearance', 'multiple diverse teams simultaneously', 'develop software following agile processes', 'cns/atm performance based navigation']"
DevOps Engineer,"Manchester, NH",JRNI,"You will be responsible for designing infrastructure, building and maintaining tools for automation, monitoring day-to-day operations and troubleshooting any…",30+ days ago,2020-11-09,,http://www.indeed.com/rc/clk?jk=3df64b76c68ccc31&fccid=eed52ac990034add&vjs=3,"It’s an exciting time to join JRNI. We’re about to embark on a transition period to move from a multi-seat monolith structure, towards a distributed and cloud-agnostic architecture, with you and your global Engineering team-mates leading the effort.. . Life at JRNI is collaborative but fast paced - You'll be at the forefront of our growth and expansion, as you'll be the first member of our Engineering Team in the US working with the other Engineers based in the UK.. You will be responsible for designing infrastructure, building and maintaining tools for automation, monitoring day-to-day operations and troubleshooting any roadblocks faced by the technical teams.. You will be;. . Partnering with our Head of Engineering and CTO suggest improvements to our DevOps processes and tools, whilst helping us to expand to additional cloud hosting environments alongside our infrastructure. Helping to extend the centralization of configuration management, monitoring and automation tools. Championing DevOps best practices alongside educating the wider technology teams to ensure our systems are able to continuously scale, remain stable and are secure. Evolving and executing daily operational activities and proactively identifying issues and optimizations in a timely manner. . This role is yours to really shape and grow into. You’re able to give consultative advice in the DevOps space, within the team and the wider business, and are excited by implementing positive change in a fast growing company and industry. This role will require you to start around the time of 8am to overlap with our CTO and Head of Engineering on UK time zones.. You will have;. . . Extensive experience (around 7+ years) establishing and owning service deployments in AWS. Solid practical experience of operating Docker and Kubernetes in production. Impeccable communication and an ability to explain complex technical architectures to those less fluent. Experience building and improving workflows and processes, and monitoring the effectiveness of existing processes and tools. Experience of web protocols and scripting languages. Familiarity with Puppet, Terraform or similar configuration/infrastructure as code tools. Knowledge of web service delivery and security tools, as well as the communication protocols and paths between components. . If this sounds like you, we’d love to hear from you! Our strong, values-driven culture makes JRNI a great place to work! We care deeply about the growth and happiness of every member of our team. We offer medical, dental and vision insurance plans, stock options for all employees, 401K plan, social events, generous time-off policy, personal learning days and lots more!. If you’d like to help us drive this even further forward then please apply now!. Equal Opportunity Employer. We are committed to creating a diverse environment and are proud to be an equal opportunity employer. All qualified applicants will receive consideration for employment without regard to race, religion, gender, gender identity or expression, sexual orientation, national origin, genetics, disability, age, or veteran status.. The above noted job description is not intended to describe, in detail, the multitude of tasks that may be assigned but rather to give you a general sense of the responsibilities and expectations of this position. As the nature of business demands change so, too, may the essential functions of this position.","['employment without regard', 'noted job description', 'cloud-agnostic architecture', 'explain complex technical architectures', 'multi-seat monolith structure', 'executing daily operational activities', 'global engineering team-mates leading', 'monitoring day-to-day operations', 'values-driven culture makes jrni', 'additional cloud hosting environments alongside']"
"Senior Software Engineer, Front End","Nashua, NH",Episerver,"Work with people who share a passion for empathizing with customers while thinking deeply about elegant solutions that scale, rigorous code reviews, automated…",6 days ago,2020-11-09,,http://www.indeed.com/rc/clk?jk=cdb0d1472bada8ca&fccid=33cb3d5d606b6d6b&vjs=3,"Episerver is looking for an experienced Senior Front-End Software Engineer to join our Account Services team. As a member of this team, you'll be building features that enable some of the world’s largest companies—including over 24 of the Fortune 100—to deliver digital experiences that delight customers through the use of experiments and personalization.. . As a Senior Front-End Software Engineer you will:. Partner with product management, engineering, and design to build user interfaces that power companies' experimentation programs. Work with people who share a passion for empathizing with customers while thinking deeply about elegant solutions that scale, rigorous code reviews, automated testing, and building high-quality enterprise software. . About you:. Production experience in single-page frontend applications built on frameworks and libraries like ReactJS, AngularJS, or VueJS. Experience with modern web testing frameworks (Karma/Jasmine, Jest, etc.), build systems (Grunt, Webpack), and have written highly scalable, reliable front-end applications. Interpersonal communication skills can work well in a diverse, team-focused environment with other engineers, product managers, designers, and so on. Strong product sensibilities and deep empathy for customers. Understand frontend challenges like application state management and asynchronous JavaScript programming. You understand the browser and its runtime, the internals of JavaScript frameworks, and the life of an API request from end-to-end. You’ve worked with APIs—perhaps you've built them from scratch or augmented existing ones as needed. Experience developing/debugging the backend. You're excited to rally engineers around you to solve a deep customer problem, even when no one asked you to. . Our Stack:. We build with React and manage state with NuclearJS, our open-source Flux implementation using Immutable.js data structures. We write ES2015, leverage Webpack and Babel to deliver an application that is written with clean code that is performantly delivered to our users. Our React components and Sass code are reusable, generic, and live standalone in the freely available OUI library.","['js data structures', 'end-to-end', 'modern web testing frameworks', 'freely available oui library', 'reliable front-end applications', 'single-page frontend applications built', 'building high-quality enterprise software', 'senior front-end software engineer', 'experienced senior front-end software engineer', 'open-source flux implementation using immutable']"
Software Engineer - SMART,"Nashua, NH",DCS Corp,"Carries out computer hardware and software security strategies for requested programs.
Reviews and executes software related test plans, test procedures,…",30+ days ago,2020-11-09,,http://www.indeed.com/rc/clk?jk=b2f56764c9e9c695&fccid=1380d0d61a54c0c0&vjs=3,"DCS is seeking an experienced Software Engineer to join our team to support the Army SMART software suite.. . Essential Job Functions:. Performs software development with extensive knowledge of 3rd and 4th Generation languages such as C, C++, C#, JAVA, and Python (C# preferred).. . Supports senior engineers performing engineering and scientific work involving the design, development, and operation of man portable computer systems, including hardware and software and their integration with other systems and peripherals.. . Reviews and executes software related test plans, test procedures, software requirement and interface specification, software design document, test scripts and test reports on technical adequacy on assigned programs, for both government and contractor testing, as well as related failure reports.. . Carries out computer hardware and software security strategies for requested programs.. . Extensive understanding of the DoD standards guiding the development of computer hardware and software policy, requirements, integration, engineering, and testing.. . Perform security, analyses and risk/vulnerability assessments of computer hardware and software.. . Periodic travel (<10%) to customer sites to interface directly with the customer, maintain databases, and resolve database issues.. . Location in Nashua, NH, other DCS location, or remote telework for qualified candidates.. . Required Skills:. Due to the sensitivity of customer related requirements, U.S. Citizenship is required.. . Bachelor's degree in relevant engineering / technology field plus 5 years of experience or a Master’s degree plus 4 years of experience is required.. . Ability to obtain Secret Clearance within 6- 9 months of hire date.. . Ability to work with a geographically-distributed team.. . Significant experience with developing software using one or more high-level languages (C++, C#, Java) – C# is preferred.. . Experience with Web Application Design and Development using one or more of the following – ASP.NET, ASP.NET Core, JavaScript, CSS, HTML5.. . Desired Skills:. Knowledge and familiarity with Microsoft Azure DevOps for team tasking, repo, and pipeline management.. . Microsoft SQL experience is a plus.. . Knowledge and familiarity with Git.. . Experience with Scaled Agile Framework (SAFe), any certification is a plus.. . Knowledge and understanding of logistics and fielding equipment needs of US Army soldiers.","['microsoft azure devops', 'scaled agile framework', 'fielding equipment needs', 'related failure reports', 'man portable computer systems', 'army smart software suite', 'developing software using one', 'relevant engineering / technology field', 'executes software related test plans', 'supports senior engineers performing engineering']"
Software Engineer,"Nashua, NH","SRC, Inc.","Oversee software development at the BAE facility in Nashua, NH.
And make recommendations to government lead engineer on software development activities.",30+ days ago,2020-11-09,,http://www.indeed.com/rc/clk?jk=362fb9ea1946ab94&fccid=950032d3c5a663a9&vjs=3,"SRC, Inc. is currently seeking a Sofware Engineer supporting a DoD program from system design through development, test activities, and fielding. The position will provide on-site government support to the Compass Call program at BAE Systems, Nashua, NH. Daily activities will be coordinated with program leadership and involve working closely with the contractor’s engineering and production teams. Duties include observing/supporting test events, program reviews, product sell-offs, and other events either on-site at BAE or at other locations to meet programmatic milestones.. . Responsibilities. Support Program Office acquisition activities including reviewing contractor technical data, reviewing schedules, preparing technical evaluations of proposals, and reviewing contract documents and operator training materials. Work with operators to validate design and test requirements. Oversee software development at the BAE facility in Nashua, NH. Evaluate contractors’ technical strategies and advise the lead engineer and program integration team. Represent the government lead engineer in technical forums where formal government direction is not required. Provide report of events and action items for lead engineer and program manager action/disposition.. Participate in or conduct meetings, design reviews, and working groups. Coordinate agendas and attendance for technical reviews and technical interchange meetings. Develop technical reports and presentations for government and contractor forums. Contribute to and review test plans, reports, and supporting data and support test teams for laboratory, ground, and open-air flight test events, as required. Review and oversee the progress of contractors in meeting project objectives.. Support human factors analyses and provide recommendations to government lead engineer to improve effective operation of the Compass Call PME. Maintain awareness of software development trends, techniques, tools, etc. and make recommendations to government lead engineer on software development activities. Attend government and industry trade shows, conferences, symposiums, meetings, etc as requested by the government lead engineer. Bachelor’s degree in computer science, engineering, mathematics or other science or technical degree; additional relevant experience may be considered in lieu of a degree. Must have at least 10 years’ experience applicable to the job duties. Understand SW development processes and techniques, including Agile SW development and implementation. Knowledgeable on current SW coding techniques, tools, languages, and processes.. Understand OMS/Open Architecture standards and implementation. Able to discuss SW testing and troubleshooting. Understand communication and radar signal processing, waveform generation, and EW effects generation techniques. Understand human-machine interface engineering and associated technology trends. Experience in design, analysis, or test of EW, radar or communications systems. Critical tasks may involve additional and non-standard work hours. Ability to work autonomously at a non-Government facility. Security Clearance Requirements. . Must be a U.S. citizen. Applicants selected will be subject to a government security investigation and must meet eligibility requirements for access to classified information. Current Secret clearance required, TS-SCI eligible, current TS-SCI preferred.. Location Nashua, New Hampshire. Employment Type Full-Time Salaried. Experience Required 10+ years. Education Required Bachelors Degree. Security Clearance Requirement Secret. Travel % 25","['additional relevant experience may', 'support human factors analyses', 'events either on-site', 'provide on-site government support', 'understand human-machine interface engineering', 'open-air flight test events', 'critical tasks may involve additional', 'understand oms/open architecture standards', 'employment type full-time salaried', 'duties include observing/supporting test events']"
Software Test Engineer,"Nashua, NH",Arista Networks,"Participate in functional specification and software design reviews held by your team and provide customer centric input.
Be the testing expert for your team.",30+ days ago,2020-11-09,,http://www.indeed.com/rc/clk?jk=a64995cbe8e3a1d2&fccid=da9c8368867819c9&vjs=3,"Company Description. . null. . Job Description. . Arista Networks is looking for world-class Software Test Engineers to help us in building the highest quality networking products you can buy. At Arista, you’ll spend your time embedded deeply into our development teams, working side by side with the developers, helping us to explore, find and fix our bugs before they can reach our customers. You will NOT spend your time running manual regressions of mind numbing, 1000 page test plans, because Arista’s developers automate all the basic functional and integration tests. Instead, you’ll bring your intelligence, creativity, and drive to work every day to help us understand how our products are going to be used by our customers and to make sure that they’re going to work every time. Your job is to find the hard bugs, the ones not easily exposed by the developers’ automated unit and product level tests.. Job Responsibilities:. Use every means possible to find the bugs in the software and/or hardware being developed by your team.. Write test plans to validate Arista features and products.. Design test network topologies to validate functionality, performance, stability and scalability of features and products.. Execute test plans to verify all aspects of the product. Identify defects and validate resolution.. Work as an agile member of a combined development and test team, running in short cycles to develop functional software in quick iterations.. Work with the developers on your team in creating their plans for automated tests to complement the exploratory testing that you perform. Be the testing expert for your team.. Participate in functional specification and software design reviews held by your team and provide customer centric input.. . Qualifications. . Proven expertise in creating test methodologies and writing test plans.. Strong knowledge in one or more of the following areas: Ethernet, RSTP/ MSTP, VLANs, IP Routing, TCP/IP, OSPF, IS-IS, BGP, IGMP, PIM SM/ SSM, QoS, L2-L3 protocols, Platform validation, HA, QOS, network management.. Experience with IXIA and/or Spirent test tools desired. Familiarity with test automation tools and scripting languages desired. BS CS/CE/EE plus 3+ years of experience. MS degree preferred. Strong communication skills.. CCIE certification a plus.. Additional Information. . All your information will be kept confidential according to EEO guidelines.","['test automation tools', 'highest quality networking products', 'time running manual regressions', 'design test network topologies', 'spirent test tools desired', 'software design reviews held', 'use every means possible', 'provide customer centric input', 'bs cs/ce/ee', 'world-class software test engineers']"
