job_title,job_location,company_name,job_summary,post_date,extract_date,job_salary,posting_url,description_text,keywords
Platform Software Engineer,"Nashua, NH",Arista Networks,The Platform software team is responsible for all aspects of the development and delivery of hardware validation and manufacturing diagnostic software.,6 days ago,2020-11-09,,http://www.indeed.com/rc/clk?jk=842c379c8b312f38&fccid=da9c8368867819c9&vjs=3,"Company Description. . null. . Job Description. . As a core member of the Platform software team, the candidate will be part of a fast-paced, high caliber team building diagnostic software to help validate high-speed digital designs and achieve high yields in manufacturing Arista Network products used in the computer networking industry's largest data centers.. The Platform software team is responsible for all aspects of the development and delivery of hardware validation and manufacturing diagnostic software. The successful candidate will work closely on a project from its early conception to the final production stage at an off-site contract manufacturer. They will work with fellow engineers and members of the hardware and manufacturing team to understand the design and validate it. Besides closely working with the hardware engineers in designing the board, they will also review the hardware specifications and produce diagnostic specifications for the board. With that as a basis, the candidate would design the code to bring all of these to life. They will also work with customers to triage and fix problems in their networks. The candidate will play a major role in improving yield at the contract manufacturer site as their software will be critical in validating the builds and quickly identify manufacturing defects.. This role demands a strong and broad software engineering background, and a good understanding of hardware board design technology as well as third party network processors. The candidate's role will not be limited to any single aspect of managing ASIC-based networking solution, but cover all aspects of bringing up new hardware, developing all features requiring hardware validation, testing the software and hardware, and supporting our customers using the products. As an experienced engineer, this role also requires that the candidate take an active part in organizing a team of engineers to tackle a project, providing vision for the project, managing the schedule for the project, and coordinating the activities of the team.. Responsibilities:. Design, implement & test production-grade diagnostics for high-speed digital boards and ASICS to help with hardware validation.. Design, implement & test manufacturing tests to validate mass production of digital boards used in data center networking product. Bring-up newly manufactured boards and the port the first level of software.. Isolate and perform root-cause analysis of reported failures. Support new platform software and hardware features. Coordinate with the hardware engineering team on bring-up schedules and feature delivery. Zeal to learn and contribute to personal as well as a business growth. Participate proactively in design discussions, design/code reviews, and project management. Create system software written in C and scripting languages (Python, Bash) for our Linux-based appliance platform. Work independently as well as in team roles.. Use a version control system to systematically document and version the diagnostic software.. Mentor younger members of the team and inculcate team spirit.. . Qualifications. . BS Computer/ Electrical Engineering with +5 years experience or MS Computer/Electrical Engineering with +2 years experience or Ph.D in Computer Science or Equivalent. BS Computer Science + 4 years experience, or MS Computer Science.  Proficiency in C/C++. Well versed in scripting languages such as Python, Perl, Tcl etc.. Embedded programming and good knowledge of OS internals (Linux/Unix).  In depth view of Computer Networking, OSI layers such as TCP/IP etc..  Has knowledge of common inter connecting buses and interfaces such as PCIe, I2C, XAUI, 10G Ethernet drivers, FPGA, Switch chips, SSL offload, TCAM programming.. Smart Bits and/or IXIA usage and performance improvement. Ability to appreciate software engineering principles and coding procedures. Additional Information. . All your information will be kept confidential according to EEO guidelines.","['quickly identify manufacturing defects', 'perform root-cause analysis', 'common inter connecting buses', 'third party network processors', 'implement & test manufacturing tests', 'high-speed digital boards', 'manufacturing arista network products used', 'managing asic-based networking solution', 'implement & test production-grade diagnostics', 'help validate high-speed digital designs']"
Software Engineer,"Manchester, NH",Trimble,"2-year degree or equivalent experience in a software-related field.
From purpose-built products to enterprise lifecycle solutions, Trimble software, hardware,…",30+ days ago,2020-11-09,,http://www.indeed.com/rc/clk?jk=19a195f4568aac67&fccid=41ffc18dec1f58bf&vjs=3,"Title: Software Engineer. Location: New Hampshire or Minnetonka, MN office. Department: Development. POSITION OVERVIEW. At Trimble Transportation Mobility we are passionate about our people, our customers, our culture, and especially our technology. Here you can become an integral member of a passionate group of developers working to solve real-world problems with the latest technology in the transportation and logistics industry. Come join us and help us build the technology that will define the future of fleet mobility solutions.. RESPONSIBILITIES. Stay on top of new and up-and-coming technologies. Possess intellectual humility - Be able to make mistakes and learn from them. Design and build sophisticated and highly-scalable systems. Join a team that challenges themselves and each other, asking how we can be better in all aspects of our work. Ensure the team’s work is of high quality through the use of best practices such as continuous integration, unit and integration testing, and code reviews. Collaborate in a culture that promotes passion in technology. Hack away at the bleeding edge of technology during our epic Hack-a-thons (and win a cool prize like a Super Star Destroyer Lego set!). REQUIRED SKILLS. 2-year degree or equivalent experience in a software-related field. 2+ years of experience developing scalable full-stack solutions. Demonstrate and describe one or more specific successes from current or past technical challenges. Experience with Java, .Net Core, GoLang or other modern languages. Experience with the Spring framework. Experience and comfort with testing tools such as JUnit, Spock, Mockito, or Cucumber. Microservice Architectures. PREFERRED SKILLS. Agile software development. Spring Boot. Relational databases such as MySQL or SQL Server. Message brokers such as Kafka or RabbitMQ. Streaming data processing such as Kafka streams or Reactive programming. Amazon Web Services. Git (GitHub preferred). Docker via Rancher or Kubernetes. Our Company. Trimble is transforming the way the world works by delivering products and services that connect the physical and digital worlds. Core technologies in positioning, modeling, connectivity and data analytics enable customers to improve productivity, quality, safety, and sustainability. From purpose-built products to enterprise lifecycle solutions, Trimble software, hardware, and services are transforming a broad range of industries such as agriculture, construction, geospatial and transportation, and logistics. For more information about Trimble (NASDAQ: TRMB), visit www.trimble.com. . Trimble Inc. is proud to be an Equal Opportunity and Affirmative Action Employer and considers qualified applicants for employment without regard to race, gender, age, color, religion, national origin, marital status, disability, sexual orientation, status as a covered veteran in accordance with applicable federal, state and local laws, or any other protected factor. EOE/M/F/V/D. #Engineering. Trimble Inc. is proud to be an Equal Opportunity and Affirmative Action Employer and considers qualified applicants for employment without regard to race, gender, age, color, religion, national origin, marital status, disability, sexual orientation, status as a covered veteran in accordance with applicable federal, state and local laws, or any other protected factor. EOE/M/F/V/D","['streaming data processing', 'fleet mobility solutions', 'enterprise lifecycle solutions', 'highly-scalable systems', 'data analytics enable customers', 'solve real-world problems', 'up-and-coming technologies', 'epic hack-a-thons', 'super star destroyer lego set', 'experience developing scalable full-stack solutions']"
Software Engineer I,"Lowell, MA","NetNumber, Inc.","Successful candidates will create and maintain software for NetNumber industry leading software products.
Working knowledge of developing software solution in a…",30+ days ago,2020-11-09,,http://www.indeed.com/rc/clk?jk=9da1ec93fb44e3f4&fccid=dd4d8dc4a03879f1&vjs=3,"NetNumber is hiring an entry level Software Engineer for our TITAN Platform and TITAN Application development teams. Duties are primarily around building software solutions using Agile methodologies. Successful candidates will create and maintain software for NetNumber’s industry leading software products.. General Characteristics. High energy with the ability to participate in a collaborative and multitasking environment.. Demonstrates ability to adapt standard techniques and procedures to perform assigned tasks.. Demonstrates ability to complete assignments.. Demonstrates ability to operate based on the principals of the Agile Manifesto.. Possesses an analytical mind and the desires to investigate problems.. Demonstrates ability to evolve verbal and written communication skills.. . Technical Skills. Ability to comprehend technical design documents.. Competent with Linux or Unix operating system.. Experience or working knowledge with the Java programming language.. Familiar with Agile stack components: GIT, Jenkins, etc.. Familiar developing software in a DevOps CI/CD environment.. Working knowledge with other languages such as Python, C/C++ is a plus.. . Education. Bachelor's degree in Computer Science or a related field.. . Software Engineer II. . NetNumber is hiring a Software Engineer II for our TITAN Platform and TITAN Application development teams. Duties are primarily around building software solution using Agile methodologies. Successful candidates will create and maintain software for NetNumber industry leading software products.. General Characteristics. High energy with the ability to collaborate and multitasks across projects.. Independently adapts standard techniques and procedures to perform assigned tasks.. Demonstrates ability take ownership and raise decision option to senior team member for completing assignments.. Demonstrates ability to operate based on the principals of the Agile Manifesto.. Possesses an analytical mind and the desires to investigate problems.. Possesses effect and written communication skills.. . Technical Skills. Ability to comprehend and contribute to technical design documents.. Competent with Linux or Unix operating system.. 1-3 Years of experience with the Java programming language.. Working knowledge of developing software solution in a SCRUM Agile methodology.. Familiar with Agile stack components: GIT, Jenkins, etc.. Familiar developing software in a DevOps CI/CD environment.. Working knowledge with other languages such as Python, C/C++ is a plus.. . Education. Bachelor's degree in Computer Science or a related field. . Senior Software Engineer. . NetNumber is hiring a Senior Software Engineer for our TITAN Platform and TITAN Application development teams. Duties are primarily around building software solution using Agile methodologies. Successful candidates will create and maintain software for NetNumber industry leading software products.. General Characteristics. High energy with the ability to collaborate and multitasks across projects and multidisciplinary teams.. Independently evaluates, selects, and adapts standard techniques and procedures to perform assigned tasks.. Demonstrates ability take ownership and make informed decisions for completing assignments.. Demonstrates ability to operate based on the principals of the Agile Manifesto.. Possesses an analytical mind and the desires to investigate problems.. Possesses effect and written communication skills.. . Technical Skills. Generate technical design documents of software solutions.. Competent with Linux or Unix operating system.. 3-5 Years of experience with the Java programming language.. Working knowledge of developing software solution in a SCRUM Agile methodology.. Experienced with Agile stack components: GIT, Jenkins, etc.. Familiar developing software in a DevOps CI/CD environment.. Competent with other languages such as Python, C/C++ is a plus.. . Education. Bachelor's degree in Computer Science or a related field.","['adapts standard techniques', 'demonstrates ability take ownership', 'comprehend technical design documents', 'independently adapts standard techniques', 'generate technical design documents', 'entry level software engineer', 'titan application development teams', 'devops ci/cd environment', 'industry leading software products', 'netnumber industry leading software products']"
Full Stack Wordpress Developer,"Nashua, NH",Sophia Institute,The developer would work collaboratively with our design team in implementing all front-end solutions and our database manager in integrating with our databases…,4 days ago,2020-11-09,,http://www.indeed.com/rc/clk?jk=ca434896a3c7e600&fccid=7e3ba0776645174d&vjs=3,"The Web Developer would be responsible for overseeing and maintaining the multiple websites Sophia Institute currently operates, as well as completing a number of near-term new website builds. The developer would work collaboratively with our design team in implementing all front-end solutions and our database manager in integrating with our databases. Sophia Institute is a dynamic, fast-growing organization with multiple divisions, and so the webmaster must relocate and operate out of our New Hampshire-based offices. Please send cover letter and resume to [SEE ORIGINAL LISTING]. . Job Duties:. . Rebuild in Wordpress and migrate the Sophia Institute for Teachers website to meet the various and growing needs of the Catholic education community.. Work collaboratively with our team to improve the functionality and ease-of-use of our existing Wordpress websites.. Maintain the health, stability, and speed of all sites, including monitoring, testing, and debugging.. Train existing staff on how to use all online features.. Ensure that all sites are optimized for search engines to drive more traffic to pages.. Work with our marketing team to develop short- and long-term promotions online, such as landing pages, integrating Google Adwords, or social media marketing needs.. Perform related work as required.. . Special Skills/Requirements:. Sophia Institute is seeking an individual who is committed to advancing its mission. The ideal candidate will have:. . . A firm commitment to the Catholic Faith and to the mission of Sophia Institute. Proficiency in front-end technologies, including HTML5, CSS3, JavaScript, jQuery. Proficiency in Wordpress theming and PHP back-end development, including the ability to convert provided designs into Wordpress themes, templates, and custom pages. Strong understanding of Wordpress database structure, REST API, and SOAP as well as how to integrate Wordpress with third parties. Experience with multi-site implementation, user permissions and content protection, Woocommerce, developing custom solutions via custom post types, Google Analytics, Amazon Web Services, and Salesforce preferred. Experience building user interfaces and developing responsive websites. Ability to convert wireframes and full designs into Wordpress themes, templates, and custom pages. Proficient understanding of code versioning tools. Passion, humility, integrity, and a mission-driven attitude. An action-oriented and flexible disposition. A strong work ethic and attention to detail. . ","['front-end technologies', 'web developer would', 'developer would work collaboratively', 'experience building user interfaces', 'social media marketing needs', 'php back-end development', 'long-term promotions online', 'please send cover letter', 'new hampshire-based offices', 'near-term new website builds']"
Full Stack Developer – Web,"Bedford, NH",RedBlack Software,"NET, OOP, Design Patterns, EF and REST API’s using ASP.
Exposure to JavaScript frameworks (preferably SPAs), AJAX, JSON, etc.",30+ days ago,2020-11-09,,http://www.indeed.com/rc/clk?jk=39c051da2e47c451&fccid=7aa75aefe4aa8c6d&vjs=3,"Full Stack Developer – Web (Experience: 4 -8 years). . Very good in C#, .NET, OOP, Design Patterns, EF and REST API’s using ASP.NET framework. Exposure to JavaScript frameworks (preferably SPAs), AJAX, JSON, etc.. Experience in developing secure and scalable multi-tier distributed web applications. . Interested applicants must apply online at www.invesco.com/careers. . The above information on this description has been designed to indicate the general nature and level of work performed by employees within this role. It is not designed to contain or be interpreted as a comprehensive inventory of all duties, responsibilities and qualifications required of employees assigned to this job. The job holder may be required to perform other duties as deemed appropriate by their manager from time to time.. . Our culture of inclusivity and its commitment to diversity in the workplace are demonstrated through our people practices. We are proud to be an equal opportunity employer. All qualified applicants will receive consideration for employment without regard to race, creed, color, religion, sex, gender, gender identity, sexual orientation, marital status, national origin, citizenship status, disability, age, or veteran status. Our equal opportunity employment efforts comply with all applicable U.S. state and federal laws governing non-discrimination in employment.","['applicable u', 'qualified applicants', 'job holder may', 'full stack developer', 'employment without regard', 'equal opportunity employer', 'equal opportunity employment efforts comply', 'interested applicants must apply online', 'federal laws governing non-discrimination', 'scalable multi-tier distributed web applications']"
Web/Mobile Developer,"Auburn, NH",C Squared Systems LLC,"Experience with software debugging techniques.
This key role is responsible for building and enhancing C Squared Systems’ internal web interface and is a member…",30+ days ago,2020-11-09,,http://www.indeed.com/rc/clk?jk=b7fa84eb5f2134c3&fccid=ff776a74a7801601&vjs=3,"C2 Systems is currently seeking a Web/Mobile Developer to join our team. This key role is responsible for building and enhancing C Squared Systems’ internal web interface and is a member of our Tools Group. You will play an important role in the organizations mobile applications development efforts (initial focus for the Android platform).. Responsibilities:. Responsible for updating and refactoring existing code. Fielding site issues. Working closely with internal customers to incorporate changes. Developing additional features and insuring cross platform functionality. Create and maintain the documentation for the application. Design and build advanced applications for Android platform. Design and execute unit tests for robustness. Continually discover, evaluate and implement new technologies to positively impact efficiencies.. Requirements:. Bachelor’s Degree in Computer Science or other technical program of study. Minimum of 2 years of software development experience. Solid understanding of C#, ASP.NET, SQL Database and JavaScript. Experience with software debugging techniques. Must have previous development experience for the Android platform. Self–Motivated individual, possessing a strong commitment to coding. Capable of juggling a variety of responsibilities. Web Server development experience preferred.. Work must be performed on site at our Auburn NH facility.","['auburn nh facility', 'internal web interface', 'build advanced applications', 'software development experience', 'previous development experience', 'web/mobile developer', 'enhancing c squared systems', 'insuring cross platform functionality', 'web server development experience preferred', 'organizations mobile applications development efforts']"
Full Stack Web Development Opportunity - Work from Home,"Manchester, NH",Performance,"Competitive hourly rates and Medical/Dental/Vision benefits are available.
During the COVID-19 pandemic, our engineers are working from home.",2 days ago,2020-11-09,,http://www.indeed.com/rc/clk?jk=58985172c7b5f8b6&fccid=dd616958bd9ddc12&vjs=3,"Job Description:. . Performance Software is a medium-sized company with a great work/life balance, specializing in providing innovative embedded software to our client companies. We are looking for passionate Software Engineers who have done significant development work with Full Stack Web development. These are contract hourly positions that are expected to last over a year. Competitive hourly rates and Medical/Dental/Vision benefits are available.. . During the COVID-19 pandemic, our engineers are working from home.. . . Job Requirements:. . Significant Full Stack Web development experience. U. S. Citizenship. Experience with some of the following: Python, NodeJS, Java, Full Stack Dev, Cloud Dev, prefer Azure. Good verbal and written communication skills. Highly motivated and self-starting attitude. BS or advanced degree in Computer Science, Computer Engineering, Electrical Engineering, or Computer Systems Engineering or equivalent development experience. . About Performance:. Performance Software Corporation is engaged in the design of Real-time Embedded Software and Hardware. This includes Avionics and Space Exploration applications such as Synthetic Vision Cockpit Displays, Flight Management System Guidance and Navigation, Platforms, and Datalink Applications. Our customers are both Commercial and Defense-related avionics and rocketry suppliers/manufacturers. We have locations in Phoenix, AZ, New Orleans, LA, Grand Rapids, MI, Clearwater, FL, Bothell, WA, and Cedar Rapids, IA. We have been in business since 1998 and have been awarded INC Magazine 5000 Fastest Growing Companies and Best Places to Work for multiple years.. . To learn more about us: https://www.psware.com/careers/. . Performance Software Corporation is an affirmative action and equal opportunity employer. All qualified applicants will receive consideration for employment without regard to race, color, religion, sex, disability, age, sexual orientation, gender identity, national origin, veteran status, or genetic information. Performance Software Corporation is committed to providing access, equal opportunity and reasonable accommodation for individuals with disabilities in employment, its services, programs, and activities. If you need reasonable accommodation to participate in the job application or interview process, to perform essential job functions, and/or to receive other benefits and privileges of employment, please discuss this with your recruiter if you are selected for an interview.","['full stack dev', 'providing innovative embedded software', 'medical/dental/vision benefits', 'perform essential job functions', 'done significant development work', 'full stack web development', 'great work/life balance', 'real-time embedded software', 'synthetic vision cockpit displays', 'flight management system guidance']"
