job_title,job_location,company_name,job_summary,post_date,extract_date,job_salary,posting_url,description_text,keywords
Software Development Engineer 1,"Concord, NH",Fortinet,You will also have a great opportunity to gain in-depth knowledge and experience working alongside some of the best and brightest software engineers in the…,30+ days ago,2020-11-09,,http://www.indeed.com/rc/clk?jk=7a429b4d13d0e93f&fccid=28d99c55a9ebe7b6&vjs=3,"Fortinet, headquartered in Sunnyvale, California, with offices around the globe including Concord, NH. Fortinet’s mission is to deliver the most innovative, highest-performing network security fabric to secure and simplify your IT infrastructure. We are a leading global provider of network security appliances for carriers, data centers, enterprises, and distributed offices.. This is an individual contributor will have the opportunity to involve in the design, implementation and the integration for Fortinet Security devices. You will also have a great opportunity to gain in-depth knowledge and experience working alongside some of the best and brightest software engineers in the network security industry. This is a full stack development position.. . Job Responsibilities:. This person will participate in the development and maintenance of the Fortinet FortiNAC product.. The candidate will be responsible for all aspects of the software development life cycle for the applicable projects, including gathering requirements, design, implementation and deployment.. Ownership of significant areas of the code for both new feature/functionality development as well as to maintain/redesign of the existing areas of the products.. Continuous focus and contribution in the areas of performance, availability & scalability, reliability, and maintainability of the product.. Job Requirements:. Strong Java programming skills.. Knowledge of computer networking, security and third party integration.. Experience with database access.. Good team player and good communication skills.. Education requirement:. Bachelor degree in Computer Science or related field is required.. Master degree is preferred.. #GD. #LI-GL1","['brightest software engineers', 'good communication skills', 'network security appliances', 'network security industry', 'gain in-depth knowledge', 'software development life cycle', 'full stack development position', 'new feature/functionality development', 'strong java programming skills', 'highest-performing network security fabric']"
"MTS 2, Software Engineer","Concord, NH",PayPal,"Deliver code in an Agile software development.
You will be responsible for all aspects of the software development lifecycle.",9 days ago,2020-11-09,,http://www.indeed.com/rc/clk?jk=47656a18140296d8&fccid=978d9fd9799d55a8&vjs=3,"Who we are: Fueled by a fundamental belief that having access to financial services creates opportunity, PayPal (NASDAQ: PYPL) is committed to democratizing financial services and empowering people and businesses to join and thrive in the global economy. Our open digital payments platform gives PayPal’s 286 million active account holders the confidence to connect and transact in new and powerful ways, whether they are online, on a mobile device, in an app, or in person. Through a combination of technological innovation and strategic partnerships, PayPal creates better ways to manage and move money, and offers choice and flexibility when sending payments, paying or getting paid. Available in more than 200 markets around the world, the PayPal platform, including Braintree, Venmo and Xoom enables consumers and merchants to receive money in more than 100 currencies, withdraw funds in 56 currencies and hold balances in their PayPal accounts in 25 currencies.. Job Description Summary: PayPal Consistent Experience Framework team provides the technology capabilities that powers the one-time payment (checkout) and repeat payments (vaulted wallet) experiences. The software this team develops enables the most significant payment volume and fastest growing revenue area for the company. As a senior member of this team, you'll be defining the technical vision of our experience framework. You will execute upon and guide the team towards that vision. You will need to be able to architect & build solutions to problems with little guidance from others. You will focus on optimizing the web application for performance, define and implement shared components, and mentor members of the engineering team. You will be responsible for all aspects of the software development lifecycle. This is an opportunity to develop experiences that delight millions of consumers each day with a high impact to PayPal, our merchants, and their customers.. Job Description:. We’re looking for strong JavaScript skills and solid real-world experience. We are seeking candidates with a strong (node.js) server background as well as those with more front-end experience. Folks strong in either area are welcome to apply. We want candidates with a vision for how to empower customers by building delightful experiences. You should be familiar with the latest tools & practices popular in the community. We hope you’re passionate about these tools and can help us make decisions about which ones will work best for PayPal. We’re looking for leaders to help move the company forward. Experience managing or contributing to open-source projects would come in handy, so would any kind of high-profile work with many contributors & customers. People will look up to you on this team, so experience in mentoring and teaching would be helpful.. We are organized as a cross-functional team composed of Front End Engineers, Product Designers, & Back End Engineers and the ideal candidate has experience working closely with all three practices. We work in a “3-in-a-box” model where we work closely with the Design Lead, Tech Lead and Product Manager to build a well-rounded experience. We are remote friendly and have teammates all over US and value our diverse culture.. We do adopt a rapid iteration lean startup and rapid experimentation approach. It’s a very fast paced highly innovative environment and we love our work and take pride in it.. Our tech stack currently uses ReactJS + NodeJS + GraphQL. Communication is key to our process, and we don't want to hinder it with walls. Collaboration is key – since we work with multiple stakeholders and teams. We have no QA department - developers test, release and monitor their own code. We keep the team in sync with daily stand-ups and have regular retrospectives to discuss things that are going well and opportunities for improvements. We value unique perspectives brought by diverse backgrounds and experiences. A broad range of ideas and perspectives help us to create the best in class product.. Remote locations available: These positions can be hired remotely in most states for US based candidates. About you. You will be instrumental in helping scope out both the near-term experience for our merchants as well as the next generation of our platform and craft solutions capable of delivering billion of hits every day. We’d like to know that you thrive in a fast-paced environment and enjoy driving innovation through rapid prototyping and iterative development.. Required Skills:. 7-10 years of experience delivering enterprise class applications, with at least 3 most recent years working in JavaScript and NodeJS. Experience building single page applications with popular JS frameworks and libraries (React, Angular, Ember, Babel, Webpack, Lodash, etc.).. Solid understanding of object-oriented design and programming concepts, core JavaScript concepts like scope/closures, the event loop and asynchronous callbacks, promises. Able to navigate full stack development easily. Experience with HTML5, CSS3, Less, Bootstrap, and cross-browser and device development.. Experience in leading projects with dependency - including design and execution and improving processes in the team independently. Experience working with large scale applications, production rollouts, monitoring and debugging live issues. Experience with test automation: TDD, unit/integration/functional testing.. Have a passion for quality and writing clean, solid, readable code that scales and performs well.. Strong desire to learn, push the envelope, and share knowledge with others.. Strong debugging and problem-solving skills across the whole tech stack - language, databases, web servers and system environment.. Proven interpersonal communication skills. Responsibilities include:. Architect solutions and execution through hands-on development, quality-assurance, and prototyping. Deliver code in an Agile software development.. Participate in development life cycle activities like design, coding, testing and production release.. Partner closely with product, design, analytics and dependencies to craft great product experiences.. Participate and promote architectural initiatives, balancing long-term velocity with short-term customer needs.. Mentoring folks in the team and collaborating with other teams to deliver best in class product. Follow and be a strong advocate for clean code principles. Drive innovation through rapid prototyping and iterative development. Extra credit: Provide your GitHub account with your resume!. We're a purpose-driven company whose beliefs are the foundation for how we conduct business every day. We hold ourselves to our One Team Behaviors which demand that we hold the highest ethical standards, to empower an open and diverse workplace, and strive to treat everyone who is touched by our business with dignity and respect. Our employees challenge the status quo, ask questions, and find solutions. We want to break down barriers to financial empowerment. Join us as we change the way the world defines financial freedom.. PayPal provides equal employment opportunity (EEO) to all persons regardless of age, color, national origin, citizenship status, physical or mental disability, race, religion, creed, gender, sex, pregnancy, sexual orientation, gender identity and/or expression, genetic information, marital status, status with regard to public assistance, veteran status, or any other characteristic protected by federal, state or local law. In addition, PayPal will provide reasonable accommodations for qualified individuals with disabilities.","['balancing long-term velocity', 'short-term customer needs', '“3-in-a-box” model', 'experience delivering enterprise class applications', 'open-source projects would come', 'paypal provides equal employment opportunity', 'experience building single page applications', 'fast paced highly innovative environment', 'navigate full stack development easily', 'purpose-driven company whose beliefs']"
Software Engineer,"Salem, NH",ioMosaic Corporation,"M.S. degrees in software engineering with undergraduate degree in Chemical Engineering a plus.
Bachelor's degree or equivalent work experience in software…",16 days ago,2020-11-09,,http://www.indeed.com/rc/clk?jk=b43c98668cafc0d7&fccid=625067d893556c3d&vjs=3,"Software Engineer. Job Purpose. ioMosaic is looking for a junior to mid-level Software Engineer with solid hands-on experience with SQL, C#, and ASP.NET development. The successful candidate will participate in the entire solution's lifecycle from research and development to deployment of enterprise applications with direct interaction with clients.. Duties and Responsibilities. Aid in the maintenance and on-going support of existing software applications, engaging users as necessary. Provide solutions to client defined data and reporting needs. Analyze manual processes and design programs to automate those processes. Design, code, test, document and write SQL stored procedures, and troubleshoot. Develop database-driven web interfaces for rapid, real-time information sharing. Collaboration with others to test and resolve issues with deliverables. Work on multiple projects providing development and maintenance work with limited direct supervision. Demonstrated commitment to continual learning while maintaining a knowledge base. Analysis, development and documentation of technical requirements. . Skills and Experience. Strong knowledge of C#, .NET, ASP.NET, ADO.NET, MVC2/3, .Net Framework, and Visual Studio 2008/2012. Strong analytical and creative problem-solving skills. Experience with relational database development using MS SQL server, stored procedures and competencies in data modeling and database design. Working knowledge of Web Services, .Net Framework and Applications, Windows Workflow Foundation, Security Vulnerabilities. Experience with AJAX, XML, XSL, XSLT, CSS, JavaScript, HTML and Web Services. Understanding and working knowledge of basic Internet protocols such as HTTP, SMTP, SOAP, POP, SSL. Minimum of 2 years of developing web-based applications. Strong communication skills. Previous experience with developing applications using Microsoft Products, i.e. Excel and MS Access is a plus. Team focused attitude. Ability to manage tasks, work both independently and with team members, and prioritize workload. Ability to meet deadlines and provide required data, documents and information to others as requested. Bachelor's degree or equivalent work experience in software engineering or related field. . M.S. degrees in software engineering with undergraduate degree in Chemical Engineering a plus","['windows workflow foundation', 'basic internet protocols', 'write sql stored procedures', 'mid-level software engineer', 'multiple projects providing development', 'real-time information sharing', 'creative problem-solving skills', 'developing web-based applications', 'develop database-driven web interfaces', 'developing applications using microsoft products']"
Associate Software Engineer,"Merrimack, NH",CAMP Systems International,"Solid understanding of objected-oriented design and software engineering principles.
During this time, you will be faced with the challenge of creating new…",30+ days ago,2020-11-09,,http://www.indeed.com/rc/clk?jk=a3ca740aae00cc80&fccid=9833baece22c6c88&vjs=3,"CAMP Systems is the leading provider of aircraft compliance and health management services to the global business aviation industry. CAMP is the pre-eminent brand in its industry and is the exclusive recommended service provider for virtually all of the business aircraft manufacturers in the world including Gulfstream, Boeing, Bombardier, Cessna, Dassault, Embraer, Beechcraft, Socata, Pilatus, HondaJet as well as Pratt & Whitney Canada and Honeywell. Our services are delivered through a “SaaS plus content” model and we serve over 16,000 aircraft worldwide. CAMP has grown from a single location company with $12MM in revenue in 2001, to over $120MM in revenue, with more than 800 employees in 12+ locations around the world. Most of this growth has come from strategic acquisitions, which have been fully integrated into the core operations of the business.. Job Summary:. In this role, you as an Engineer will work within a small Agile Scrum team, assigned to a various Product Line. During this time, you will be faced with the challenge of creating new applications, as well as fixing, updating, and modifying legacy software. Our system works heavily with JavaScript, and the MS Suite of technology. You MUST be a strong devoted coder. This is a hands on position, we want someone who is focused, and passionate about coding, and development. Flexibility is everything, our team members are all FULL STACK MASTERS, and you have to be open to working and taking on new and old technologies alike.. . We expect all of our team members to contribute towards building a culture of continuous learning and improvement. We like to think we are open to new approaches and ideas. CAMP offers a unique domain, as well as a chance to be part of a product that effects the readiness, safety, and performance of nearly every major manufacturer of business aircraft. As like many of our team, if you are selected, with hard work, a continued quest for knowledge, and a knack for troubleshooting, there are endless possibilities for growth and development.. . Requirements:. Bachelor’s Degree in Computer Science or related field.Highly proficient with 1-5 years of experience in Microsoft development stack including C#, ASP.NET, and Visual Studio.Solid understanding of objected-oriented design and software engineering principles.Good working knowledge of coding and architectural design patterns (MVC, MVVM).Strong working experience with JavaScript, JavaScript frameworks (ExtJS, JQuery, Angular, etc.), CSS and HTML (preferably ExtJS).. Benefits:. CAMP offers a competitive salary and a comprehensive benefits package including Medical, Dental, Vision, Life Insurance, LTD, 401k w/Match, FSA, EAP, Gym Reimbursement, Tuition Assistance + More!","['architectural design patterns', '401k w/match', 'world including gulfstream', 'full stack masters', 'global business aviation industry', 'small agile scrum team', 'exclusive recommended service provider', 'nearly every major manufacturer', 'microsoft development stack including c#', 'comprehensive benefits package including medical']"
Software Engineer,"Manchester, NH",Consolidated Communications,"Candidate should be familiar with build and configuration software used in our environment.
The Software Engineer directs the solution design of new functions…",30+ days ago,2020-11-09,,http://www.indeed.com/rc/clk?jk=4987b47cf494e9da&fccid=72c3a5f37915efac&vjs=3,"Major Duties. . . Classification: Exempt, Non-Bargaining. This position may be located in Manchester, NH; Conroe TX; Charlotte NC; Roseville CA). The Software Engineer directs the solution design of new functions and features from conception to completion for systems and applications as well as provides support for multiple applications that run throughout the Consolidated Communications footprint.. The Software Engineer works with the business management and end-users to conceptualize a new project; enhancement or change in functionality recommends strategies and then designs the requirements. This requires understanding business functionality, technical system interfaces and database design of the applications..  The Software Engineer also evaluates the financial cost of each of the projects to ensure the business case is justified. They will work to maintain application stability and minimize downtime for users as well as work with team to understand upcoming changes and deploy updates/patches for assigned applications. This requires excellent troubleshooting skills and understanding assigned applications as well as system infrastructure and business expectations.. . Responsibilities. . Works with the business community to understand current issues and problems with the application, architecture, business process and combination thereof to determine root cause and design the most effective solution. Defines end user/systems requirements for new project and programs. Participates in the design and review of new product requirements and technical design. Designs functionality to include modifications to existing product process, or the creation of new processes. As required supports the system testing phase by reviewing the testing plans and execution results. Works with the technical teams and the end-users when resolving defects found in testing. Works with subject matter experts and other architects to define business and system requirements, conduct process and data modeling and support the IT Enterprise architecture development. May perform Tier 2 review of all false defects identified during testing routines. Contribute towards development of future technology direction in conjunction with other IT teams. Contributes to departmental activities and programs by accomplishing related tasks as needed. Performs System Administrator functions for multiple applications. Works with internal and external business partners in error resolution. Participates in the knowledge transfer for new applications being supported by the team. Responsible for Deployments, including upgrades and patching relating to multiple applications, within multiple environments. Cross trains with other team members on supported applications and new applications assigned to the team. Assists in implementing automation to relieve manual tasks performed by team members. Generates and organizes application support documentation. Contributes to departmental activities and programs by accomplishing related tasks as needed. Identifies areas of improvement within the support model. Qualifications. . . Knowledge, Skills & Abilities:. The candidate must have experience creating web pages, APIs and applications using some or similar technologies listed below.. CSS 3. SOAP services. Spring Framework + Spring Boot. . HTML 5. SASS. .NET Framework. . JavaScript. JSP/JSF. .NET Core. . RESTful services. JAVA. ASP.NET/MVC. . . Candidate should have an understanding of the application server software listed is below.. Apache. Tomcat. Candidate should have experience with the following database technologies.. SQL (MySQL). Linux. . Oracle. Unix. . SQL Server. Windows Server 2003 / 2008 / 2012 / 2016. . PowerShell. Windows XP / Windows 7. . Candidate should be familiar with build and configuration software used in our environment.. Maven. Webpack. Nuget. . Grunt. Git. SVN. . Eclipse. Yarn. Weblogic. . Experience working with various data and voice providers and users a plus. Experience in the identification and resolution of user/implementation requirements.. Business process and reengineering experience, as well as an understanding of the relationship between processes and policies.. Strong understanding of the organization's goals and objectives.. Good written and oral communication skills; good interpersonal skills.. Ability to conduct research into system issues and products as required.. Ability to present ideas in business-friendly and user-friendly language.. Highly self-motivated and directed, with keen attention to detail.. Proven analytical and problem-solving abilities.. Ability to effectively prioritize tasks in a high-pressure environment.. Customer service orientation.. Experience working in a team-oriented, collaborative environment.. Experience with hardware & Operation system selection, installation and configuration as well as virtualization. Strong troubleshooting and analysis abilities. Strong documentation and organizational skills. Ability to understand existing system processes in order to document or analyze for efficiencies. Required Education & Experience:. Bachelor's degree and equivalent 2-4 years related experience. Experience in telecom operations a plus. Experience in cross functional project management. Experience integrating customer requirements and system improvements. Experience in the identification and implementation of cross-functional process and system improvements that support expense reduction. Equal Opportunity Employer. . . All qualified applicants will receive consideration for employment without regard to race, color, religion, sex, gender identity or expression, sexual orientation, national origin, marital status, familial status, genetics, disability, age, veteran status or any other characteristic protected by law.","['equivalent 2-4 years related experience', 'may perform tier 2 review', 'requires excellent troubleshooting skills', 'performs system administrator functions', 'experience creating web pages', 'software engineer also evaluates', 'hardware & operation system selection', 'spring framework + spring boot', 'relieve manual tasks performed', 'defines end user/systems requirements']"
