job_title,job_location,company_name,job_salary,description_text,keywords
Associate Software Engineer/Developer,"Albany, NY","Health Research, Inc.",,"Minimum Qualifications :. . A Bachelor’s degree in Software Engineering, Computer Science or Information Technology or a closely related field and three years computer programming, database design/development, or systems analysis experience; OR an Associate’s degree in Software Engineering, Computer Science or Information Technology or a closely related field and five years of such experience; OR seven years of such experience. A Master's degree in Software Engineering, Computer Science or Information Technology or a closely related field may substitute for one year of experience.. . The incumbent in this position will be required to have a telephone/mobile device, and internet access.. Preferred Qualifications :. . Experience using Java, Spring MVC, Hibernate/MyBatis, and REST web services. Work experience with programming large scale web applications using Spring MVC from specifications expressed by use cases, class diagrams, interaction diagrams and sequence diagrams. Experience developing Oracle database schemas, tables, procedures and permissions. Experience with SQL and JavaScript. Experience with HL7.. Responsibilities :. . The Associate Software Engineer/Developer will perform computer application development in support of the Epidemiology and Laboratory Capacity grant deliverables. The incumbent will design, test, implement and deploy Java/JavaScript web applications that collect, process and report out on public health needs. The incumbent will be responsible for application development tasks including researching and documenting technical designs, programming solutions, writing and executing unit test plans, researching, resolving, and testing defects, and customer technical support. The incumbent will develop appropriate documentation in work assignments such as documentation in code repositories and technical design documents. The incumbent will be responsible for the release management process including technical steps to promote, test and release through the development environment, coordinating with infrastructure staff. The incumbent will serve as a liaison with grant partners throughout the project, coordinate joint application design sessions with other technical and program staff and coordinate grant reporting activities; other related duties as assigned.. Conditions of Employment :. . Grant funded position. Compliance with funding requirements such as time and effort reporting, grant deliverables, and contract deliverables, is required.. . Valid and unrestricted authorization to work in the U.S. is required. Visa sponsorship is not available for this position.. . HRI participates in the E-Verify Program.. . Affirmative Action/Equal Opportunity Employer/Qualified Individuals with Disabilities/Qualified Protected Veterans. . www.healthresearch.org","['executing unit test plans', 'coordinate grant reporting activities', 'perform computer application development', 'disabilities/qualified protected veterans', 'closely related field may substitute', 'experience developing oracle database schemas', 'deploy java/javascript web applications', 'application development tasks including researching', 'coordinate joint application design sessions', 'affirmative action/equal opportunity employer/qualified individuals']"
SOFTWARE DEVELOPER,"Farmingdale, NY",Brandon Systems,,"Brandon Systems (a Brandon Associates company) is searching for a Software Developer to perform the duties of programming, web development, web design, and database programming for our new and existing clientele. Candidate should:. . Be able to conceptualize full project life cycle. Understand the importance of iteration and testing. Have outstanding creative skills coupled with the ability to achieve excellence in a team environment.. RESPONSIBILITIES:. Implement new systems and perform system maintenance based upon client requirements.. Develop implementation plans, test plans and documentation for new and existing projects. Work on program changes under direction of Development Team. REQUIREMENTS:. Implement new systems and perform system maintenance based upon client requirements.. Develop implementation plans, test plans and documentation for new and existing projects. Work on program changes under direction of Development Team. . Desired but not required skills include: IIS, ASP.NET, .NET Core, C#, JavaScript, CSS, HTML, React/Redux, CI/CD, Git, Azure DevOps (VSTS), AWS/Azure Cloud Resources. . Location. Farmingdale, NY,. Wichita, KS. or Remote. . Job Type. Paid:. Contract position or full time. . Compensation. Commensurate with experience. . Start Date. Available immediately","['azure devops', 'brandon systems', 'full time', 'implement new systems', 'brandon associates company', 'develop implementation plans', 'required skills include', 'aws/azure cloud resources', 'outstanding creative skills coupled', 'conceptualize full project life cycle']"
Front End Developer - A/B Testing,"New York, NY",ANN Corporate,,"Brand Overview:. ascena retail group, inc. is a leading national specialty retailer offering apparel, shoes, and accessories for women under the Premium Fashion segment (Ann Taylor, LOFT, and Lou & Grey), Value Fashion segment (dressbarn), Plus Fashion segment (Lane Bryant and Catherines), and for tween girls under the Kids Fashion segment (Justice). ascena retail group, inc. operates ecommerce websites and approximately 2,800 stores throughout the United States, Canada and Puerto Rico.. Ready to apply? We currently have an opportunity for a Front End Developer - A/B Testing to join our team located at our Times Square Tower-ANN-New York, NY 10036.. Position Overview:. **Position can be remote or in NYC Office**. Front End Developer - A/B Testing. About the Position:. The A/B Testing / Front-end Developer is supporting our Optimization, Personalization program for AnnTaylor.com, LOFT.com, Anntaylorfactory.com and LOFTOutlet.com web and mobile experiences.. The ideal candidate is a recent college graduate or an experienced professional primarily responsible for using Adobe Target and Analytics to design, build, run, and analyze experiments and personalized experiences across Ascena brands. You will be responsible for helping to deliver and improve the customer experience across client’s digital channels.. Key Responsibilities and Duties:. Design Adobe target technical solutions to drive multi-touch/multi-channel marketing, defined by the client's journey. Deliver against the website optimization and personalized experience strategies across the website and other touch points.. Liaise with product manager and UX design to build new UI and functionality. Debug, troubleshoot, and fix the configuration and integration issues.. Partner with the analytics teams on measurement across customized site experiences. Communicate and partner with upstream and downstream teams regarding the execution against the desired testing strategy. Drive technical effort working with IT partners, site management and creative to ensure timely execution of testing and/or personalization cadence. Develop JavaScript, CSS, and HTML. Qualifications/Requirements:. Bachelors or Master’s Degree in Computer Science or IT. 1+ years of experience. Working experience in HTML, CSS, JavaScript, jQuery, Javascript Frameworks (such as BackboneJS, React, Ember.js, Vue.js or Angular). Knowledge with A/B testing and site personalization technologies, preferably leveraging Adobe Target as a platform. Ability to learn new technologies at high level to identify use opportunities. Self-motivated, responsive, professional with problem-solving, and solutions-oriented mindset. Solid organizational, presentation, and communication skills (verbal and written). Ability to learn quickly, be a team player, and manage change effectively. #LI-LL1. Location:. Times Square Tower-ANN-New York, NY 10036. Position Type:. Regular/Full time. Equal Employment Opportunity. The Company is committed to hiring and developing the most qualified people at all levels. It is our policy in all personnel actions to ensure that all associates and potential associates are evaluated on the basis of qualifications and ability without regard to sex (including pregnancy), race, color, national origin, religion, age, disability that can reasonably be accommodated without undue hardship, genetic information, military status, sexual orientation, gender identity, or any other protected classification under federal, state, or local law. We do not discriminate in any of our employment policies and practices. All associates are expected to follow these principles in all relationships with other associates, applicants, or others with whom we do business.. Corporate Remote Location-ANN-New York, NY 10036","['personalized experience strategies across', 'preferably leveraging adobe target', '/b testing / front-end developer', 'drive technical effort working', 'design adobe target technical solutions', 'personalized experiences across ascena brands', 'measurement across customized site experiences', 'corporate remote location-ann-new york', 'drive multi-touch/multi-channel marketing', 'times square tower-ann-new york']"
Front End Engineer,"New York, NY",AlphaSights Ltd.,,"This is a predominantly remote role. Minimal in-office working time may be required when our offices re-open.. . At AlphaSights, we search through more than 500 million professionals working in the world today to find the small handful of experts qualified to answer our clients' needs. They use these insights to drive amazing progress within their organizations. Our mission is to provide access to dispersed, hidden, and underutilized knowledge. We’ve made terrific progress working in this new space, but we’ve only just scratched the surface on how we can apply technology to this problem.. . As a Front End Engineer on our Search & Discovery team, you will enable the next generation of our discovery experience by building ambitious web applications, on the edge of what is possible with today's browsers. You'll work closely with a variety of people in the business to arrive at the best solution, immediately see the impact of your work, and get feedback directly from users. We're looking for people who are interested in building software systems to an incredibly high standard, comfortable working across multiple languages, and learning new technologies as needed.. . You will:. . Push the boundaries of modern front end engineering to build elegant, intuitive and optimized web applications. Work closely with our Product Team and Design Team to identify, design and build features that have a significant business impact. Work in small, nimble teams and form part of a highly talented guild that determines front end direction and best practices.. . You might:. . Build UIs to schedule multi-party communication with heavy constraints. Develop innovative interfaces that enable intuitive discovery and exploration of structured knowledge. Launch new product initiatives that delight our clients and differentiate our services. . You might be a fit if you:. . Have at least 3 years of industry experience. Are passionate about delivering high performance solutions. Have a solid understanding of JavaScript fundamentals and also understand the complexities of the DOM and CSS, especially how they interact. Know and understand the implications of the latest developments in ECMAScript. Navigate and write backend code where necessary. React experience a plus. . We believe a broad spectrum of experience provides a great perspective on solving problems in new and innovative ways. If your background doesn't check all the boxes above, but you are passionate about front end engineering, we’d still love to hear from you.. . Who you would work with:. . You would join a dynamic, multinational, and diverse team who enjoy solving interesting problems in a collaborative and distributed environment. We have self-taught engineers as well as graduates from top Computer Science and Engineering schools. Your co-workers will include motivated recent graduates as well as experienced industry leaders from companies such as Google and Amazon. . About AlphaSights:. . AlphaSights is a leading global industry research platform. We leverage proprietary knowledge search technology powered by machine learning, natural language processing and data science to connect decision makers to globally distributed knowledge faster than ever before. Professionals at investment firms, consultancies, corporations and non-profits rely on us to connect them seamlessly with knowledgeable domain experts who help enhance their thinking, inform critical decisions and propel their business forward. Founded in 2008, AlphaSights currently employs nearly 1,000 professionals in nine offices around the globe and regularly ranks as one of the fastest-growing companies in the world. AlphaSights has been consistently profitable since 2010, is internally (not VC/PE) funded and pursues a strategy of ambitious long-term growth.. . Find out more: http://engineering.alphasights.com","['include motivated recent graduates', 'determines front end direction', 'delivering high performance solutions', 'drive amazing progress within', 'schedule multi-party communication', 'ambitious long-term growth', 'made terrific progress working', 'leading global industry research platform', 'comfortable working across multiple languages', 'minimal in-office working time may']"
Senior Web Developer - HR Engineering,"New York, NY",Bloomberg,,"With more than 19,000 employees, Bloomberg HR Engineering builds systems to ensure that our global company is able to run smoothly and efficiently. The HR teams rely on our products to ensure that complex workflows involving anything from recruiting, employee onboarding, talent management, to compensation, are streamlined and top-notch.. . Our organization would not be anywhere without our employees and the products we build are critical in making sure our employees have the resources they need. Along with working closely with our product team, you will get the chance to work with top executives and other stakeholders to help them manage mission critical processes and gather requirements for developing the next generation of products.. . The HR Engineering team is responsible for designing and developing complex workflows for products in the area of…. . 1) Talent Management: Products for handling employee performance processes year-round- we do this by considering all workflows for various organizations and employee scenarios, while also developing complex reporting tools to provide aggregates and trends.. . 2) Payroll Processes: Platform for discovery and transparency of employee pay-slips, tax documents, etc. We are building an admin functionality for managing different payroll cycles and release/visibility rules across the globe and streamlining processes for integrating with various payroll vendors.. . 3) Employee Management: Products for employees to manage employee information, including contact details and availability. We provide APIs and services for employee data consumption by other teams and products. Our database handles about 3 billion hits a day and employee info service handles about 1 million hits a day!. . 4) Enterprise Document Storage: Product to securely store and index sensitive HR documents and allow for document discovery for HR admins.. . 5) Vendor Management and Integrations: Participate in vendor evaluation, product prototyping, and product integration for various third-party solutions to use across the HR department.. . We'll trust you to:. Collaborate within an Agile, multi-disciplinary, fast-moving team. Communicate and interact with product managers and end users. Work across multiple teams in Engineering. Bring in best-in-class open-source technologies (with option to contribute back). You’ll need to have:. 3+ years of experience working with modern web frameworks like React. Experience with CSS, HTML and Javascript (ES5/ES6). Experience working with APIs and API Best Practices (REST, GraphQL). Working knowledge of databases (SQL, noSQL). Experience shipping high-profile user-facing products, working with large code bases, and engineering features for security, scalability, and high availability. BA, BS, MS, PhD in Computer Science, Engineering or related technology field or equivalent industry experience. We’d love to see:.  Experience working with C# or .Net Core framework. Experience working in a Linux environment. Knowledge of DevOps, Continuous Integration, Automated Testing, and Deployment tools. SRE Mindset (debugging, performance, low-latency). . We are an equal opportunity employer and value diversity at our company. We do not discriminate on the basis of race, religion, color, national origin, gender, sexual orientation, age, marital status, veteran status, or disability status.","['index sensitive hr documents', 'complex workflows involving anything', 'managing different payroll cycles', 'various third-party solutions', 'release/visibility rules across', 'also developing complex reporting tools', 'bloomberg hr engineering builds systems', 'handling employee performance processes year-round-', 'best-in-class open-source technologies', 'experience shipping high-profile user-facing products']"
PowerBI Developer Analyst,"Yorkshire, NY",Integrity IT Solutions Limited,,"My client is an extremely successful FTSE 250 manufacturer with a genuine global presence. They are seeking to recruit a talented and resourceful PowerBI developer/analyst with a strong track record in building Business Intelligence applications with real depth and resilience.. They are keen to meet candidates with the following profile:. In-depth understanding of Power BI for data extraction, transformation and loading (ETL) and building analysis models, standard reporting outputs and reporting dashboards.. Exposure to previous BI migrations would be deemed advantageous.. Excellent understanding of Power Apps, Power Automate and Power Virtual Agents. In-depth understanding of database management systems, online analytical processing (OLAP) and ETL (Extract, transform, load) framework.. Knowledge of SQL queries, SQL Server Reporting Services (SSRS) and SQL Server Integration Services (SSIS).. Crystal reporting skills.. Web development skills.. Sound knowledge of operational business processes end to end (CRM, sales, purchasing, manufacturing, transport, financials, etc).. Sound knowledge of the functionality of the business systems (ERP and peripheral) and how this is applied specifically by the companies across the Polypipe group.. Numerical and data analysis skills.. Knowledge of IT professional standards (ITIL).. Advanced skill levels with full Microsoft Office Suite.. Business analyst skills and experience, including process mapping","['building analysis models', 'business analyst skills', 'operational business processes end', 'sql server reporting services', 'building business intelligence applications', 'previous bi migrations would', 'sql server integration services', 'resourceful powerbi developer/analyst', 'extremely successful ftse 250 manufacturer', 'full microsoft office suite']"
"Associate Front-End Engineer, Core","New York, NY",Vimeo,,"At Vimeo, we love designing and engineering tools that combine power with ease of use. Our engineers work on professional-grade video tools for creators and have the opportunity to do way more than write code.. . We're a small team that cares about collaboration, encourages curiosity, celebrates technical excellence, and is driven by careful attention to detail and planning for the future. We believe diversity of perspective and experience are key to building great technology and believe that the best way to iterate towards success is by taking care of ourselves, our families, our users, and one another.. . What you'll do:. . Build and improve upon our already first-in-class tools for video creators that combine high-quality user experience with performance and scalability. Work closely with our Design and Product teams to move projects from conception to launch, then iterate, build, and test new features. Write clean, well-tested, and performant front-end code, using JavaScript, Typescript, React and styled components. Grow technically and professionally in a collaborative and inclusive environment with opportunities to learn and share with others. . Required qualifications:. . Proficient in programming fundamentals - including performance and design patterns. An understanding of JavaScript, HTML5, CSS, and the DOM. An eye for product design and interactivity. Experience working on a user-facing project. Ability to work on tasks of various sizes while keeping larger objectives in mind. Are able to communicate and collaborate respectfully and effectively with both technical and non-technical teams. Pay great attention to detail and customer focus on every project no matter the size. . Desired qualifications:. . Experience with the React framework. Experience working with Restful APIs. . About us:. . Vimeo is the world's leading professional video platform and community. We empower over 200 million users — from creatives to entrepreneurs to the world's largest brands — to grow their business with video. Our products make it easy to create high-quality, impactful videos and to reach teams, audiences and customers anywhere.. . Vimeo is powered by a growing team of over 650 passionate, dedicated humans. We're headquartered in New York City with offices around the world. We believe our impact is greatest when our workforce represents the diverse and global community that we serve, and we're proud to be an equal opportunity employer where diversity, equity and inclusion is prioritized in how we build our products, leaders and culture. Learn more at www.vimeo.com/jobs.","['test new features', 'keeping larger objectives', 'new york city', 'user-facing project', 'create high-quality', 'professional-grade video tools', 'leading professional video platform', 'performant front-end code', 'combine high-quality user experience', 'already first-in-class tools']"
Associate Chemist L1 - 00060342,"New York, NY",NYC Health + Hospitals,,"Marketing Statement. . . NYC Health + Hospitals/Metropolitan is the community hospital of choice for residents of East Harlem, northern Manhattan, and neighboring communities. The hospital provides culturally-sensitive care in a welcoming and hospitable setting, emphasizing primary care medicine and utilizing the latest advances in medical science. Metropolitan delivers high quality health services with compassion, dignity, and respect to all, without exception. Since its founding in 1875, the hospital has been affiliated with New York Medical College, representing the oldest partnership between a hospital and a private medical school in the United States. Metropolitan is a part of the NYC Health + Hospitals, the largest municipal hospital and health care system in the country.. . Job Description. . . Duties include, but not limited to:. 1. Performs and/or supervises the performance of chemical analyses and chemical or. physical tests on blood, urine and other body fluids, air, water, narcotic drugs,. construction materials, documents, food, paints and allied products, insecticides,. combustibles, fuels, and other substances, as required.. 2. Prepares reports on results of analyses.. 3. Prepares solutions, reagents; standardizes and utilizes quality control procedures.. 4. Devises tests and installs new methods and procedures.. 5. Tests, calibrates and makes minor repairs to instrumentation and equipment utilized in. chemical work.. 6. May prepare for court testimony and testify in court as an expert in defense of findings.. 7. May supervise and train subordinates.. 8. In the temporary absence of supervisor, may perform the duties of that position.. 9. Other duties, as needed. . . Minimum Qualifications. . . 1. A Baccalaureate Degree from an accredited college, including or supplemented by 24 credits in chemistry, chemical engineering, or forensic science, and three years of satisfactory full-time experience in chemical work; or. 2. Education and/or experience equivalent to 1 above. However, all candidates must have the 24 credits as described above.. . How To Apply. . . If you wish to apply for this position, please apply online by clicking the ""Apply Now"" button.","['makes minor repairs', 'installs new methods', 'nyc health + hospitals', 'health care system', 'nyc health + hospitals/metropolitan', 'new york medical college', 'utilizes quality control procedures', 'satisfactory full-time experience', 'emphasizing primary care medicine', 'hospital provides culturally-sensitive care']"
