job_title,job_location,company_name,job_salary,description_text,keywords
Jr. Data Scientist,"Hayward, CA",Potrero Medical Inc.,,"At Potrero Medical, our mission is to help clinicians transform patient care by developing a predictive technology platform for supporting the early detection of critical illnesses.. . Our medical device, the Accuryn® Monitoring System, received 510(k) clearance from the FDA in 2016 and helps hospitals accurately measure patients’ vital signs such as urine output, body core temperature, and intra-abdominal pressure.. . We are a Silicon Valley-based predictive health company developing the next generation of medical devices with smart sensors and artificial intelligence. Founded in the historical Potrero Hill neighborhood of San Francisco, we emerged out of Theranova, a MedTech incubator focused on tackling the biggest challenges in healthcare.. Jr. Data Scientist. . POSITION DESCRIPTION. This role will assist the data science team in performing exploratory data analysis, algorithm development and statistical analysis of clinical data as well as writing publications and other scientific documents. Additionally, the role will occasionally be required to contribute to infrastructure and testing of data pipelines.. . ESSENTIAL FUNCTIONS (Included but not limited to). Python. Ability to modify or write scripts with pandas, NumPy that move data, provide visualizations, or perform other analysis.. Ability to debug code. Understanding of the fundamentals of statistics and machine learning.. Understanding of how to visualize data.. Open minded and flexible. Ability to absorb and learn new concepts.. Curiosity and love of science.. Work well both independently and as a part of a team.. Perform additional responsibilities or other functions as assigned. . REQUIREMENTS. 2+ years’ experience preferably in the medical device or a similarly regulated industry.. Ability to test code to ensure that it works.. Ability to query analytics databases (SQL).. Exposure or familiarity with clinical trial statistics.. Basic knowledge of biology or medicine.. Ability to read scientific literature.. Familiarity with Agile methodology.. Responsible for performing all duties in compliance with FDA’s Quality System Regulation (QSR), ISO13485, ISO 14971, the Canadian Medical Device Regulations, and all other international regulatory requirements with which Potrero Medical complies.. . EDUCATION. BS in data science or similar field. M.S./Ph.D preferred.. . Reasonable accommodations may be made to enable individuals with disabilities to perform the essential functions.. . WORK ENVIRONMENT. This job operates in a professional office environment, it can be performed remotely.. This role routinely uses standard office equipment such as computers, phones, photocopiers, filing cabinets and fax machines.. . . PHYSICAL DEMANDS. The physical demands described here are representative of those that must be met by an employee to successfully perform the essential functions of this job.. While performing the duties of this job, the employee is regularly required to talk or hear and participate in conference calls. While performing the duties of this job, the employee is regularly required to type at a keyboard and produce working computer software.. The employee is occasionally required to sit; balance; and stoop, kneel, or crouch. The employee must frequently lift and/or move up to 10 pounds and occasionally lift and/or move up to 25 pounds. Specific vision abilities required by this job include close vision, distance vision, color vision, peripheral vision, depth perception and ability to adjust focus.. . . EQUAL EMPLOYMENT OPPORTUNITY (EEO) STATEMENT. We are an equal opportunity employer and value diversity in our company. We do not discriminate on the basis of race, religion, color, national origin, gender, sexual orientation, age, marital status, veteran status, or disability status.","['equal opportunity employer', 'performing exploratory data analysis', 'employee must frequently lift', 'job include close vision', 'specific vision abilities required', 'canadian medical device regulations', 'historical potrero hill neighborhood', 'produce working computer software', 'help clinicians transform patient care', 'helps hospitals accurately measure patients']"
Data Scientist - Analytics,"San Francisco, CA",Plaid,,"We believe that the way consumers and businesses interact with their finances will drastically improve in the next few years. Our goal is to build the tools and infrastructure for developers to create this next generation of financial services applications. Today, thousands of companies such as Acorns, Stripe, and Venmo rely on Plaid to integrate with banks and the financial system. Plaid’s infrastructure handles millions of requests per day and thousands of bank integrations. We pride ourselves on maintaining a robust API to support the developers who depend on us and the millions of consumers who use their apps.. . Making data driven decisions is key to Plaid's culture. To support that, we need a data science team that can apply their analytical skills to understand our users and influence decision making. This includes: building and maintaining core data sets and metrics, helping teams like Developer Experience and Consumer Experience design experiments and running in-depth follow up analyses, and supporting, educating, and providing guidance to teams on their product decisions.. . We're guided by our principles including impact, growing together, embracing openness and positivity, inventing tomorrow; we’re looking for leaders who are motivated by those same principles.. What excites you. Working closely with product teams to identify important questions and answer them with data. Designing and interpreting experiments to measure the impact of new features on Plaid. Defining core data sets and schemas, as well as visualizing and tracking key metrics. Running impactful inferential analyses and data investigations to identify recurring patterns, root causes, and propose actionable product solutions. Communicating analyses and data-backed recommendations to stakeholders. Championing a data-first approach toward decision-making across the entire organization. Mentoring and growing other data scientists into senior roles and establishing a culture of statistical excellence. What excites us. 5+ years of industry experience in a Product Data Science role. Deep understanding of various statistical techniques and experimentation analysis workflows. Strong familiarity with SQL, data visualization tools, and working knowledge of Python. Data engineering experience and data pipeline tooling (e.g. Airflow, Redshift) experience is a plus. Bachelor's degree or equivalent work experience in Computer Science, Mathematics, Statistics, Operations Research, Economics, or a closely related field. We are an equal opportunity employer and value diversity at our company. We do not discriminate on the basis of race, religion, color, national origin, gender, sexual orientation, age, marital status, veteran status, or disability status.","['influence decision making', 'product data science role', 'consumer experience design experiments', 'maintaining core data sets', 'running impactful inferential analyses', 'making data driven decisions', 'propose actionable product solutions', 'defining core data sets', 'running in-depth follow', 'data-first approach toward decision-making across']"
"Data Scientist, Machine Learning innovator","San Francisco, CA",Standard Chartered,,"Job: Technology. Primary Location: Europe & Americas-United States-San Francisco. Schedule: Full-time. Employee Status: Permanent. Posting Date: 05/Nov/2020, 11:29:03 AM. Unposting Date: Ongoing. . About Standard Chartered. We are a leading international bank focused on helping people and companies prosper across Asia, Africa and the Middle East.. . To us, good performance is about much more than turning a profit. It's about showing how you embody our valued behaviours - do the right thing, better together and never settle - as well as our brand promise, Here for good.. . We're committed to promoting equality in the workplace and creating an inclusive and flexible culture - one where everyone can realise their full potential and make a positive contribution to our organisation. This in turn helps us to provide better support to our broad client base.. . The Role Responsibilities. . We research systematic trading ideas that predict the future of financial markets, applying scientific techniques to find patterns in large, noisy and rapidly changing real-world data sets. We are working on the fringes of the possible, innovating new techniques where necessary. We also build on the latest academic research into optimisation methods to find innovative solutions that overcome the simplified assumptions of traditional financial maths. Hence the following are key:. Design and develop client centric and bank wide ML-powered analytical products. Provide necessary data analytics support to various internal stakeholders, including (but not limited to): sales, relationship managers, leadership, traders. Develop machine learning and advanced analytics solutions with the aim of improving yields from the business and enable improved customer experience.. Work alongside existing analytics teams to enable consistent approach to data requirements. Work alongside engineering team to make the models production-ready and deployable for use of internal customers. Regulatory & Business Conduct. Display exemplary conduct and live by the Group’s Values and Code of Conduct.. Take personal responsibility for embedding the highest standards of ethics, including regulatory and business conduct, across Standard Chartered Bank. This includes understanding and ensuring compliance with, in letter and spirit, all applicable laws, regulations, guidelines and the Group Code of Conduct.. Effectively and collaboratively identify, escalate, mitigate and resolve risk, conduct and compliance matters.. Key Stakeholders. Global Head of Digital Channels and Data Analytics, Global Heads of Credit and Rates Trading. Our Ideal Candidate. MSc./PhD in a quantitative discipline (e.g. mathematics, physics, computer science, engineering). Ability to learn new skills (e.g. new programming languages, new business terminology). Apply now to join the Bank for those with big career ambitions.. . To view information on our benefits including our flexible working please visit our career pages. We welcome conversations on flexible working.","['research systematic trading ideas', 'enable improved customer experience', 'work alongside engineering team', 'leading international bank focused', 'companies prosper across asia', 'provide necessary data analytics support', 'work alongside existing analytics teams', 'rapidly changing real-world data sets', 'bank wide ml-powered analytical products', 'europe & americas-united states-san francisco']"
Senior Data Scientist,"San Francisco, CA",Carbon Health,,"WHAT IS CARBON ALL ABOUT?. . Our mission is making world-class care accessible to everyone. Carbon Health is a modern healthcare provider that combines smart technology with inviting clinics. We deliver a uniquely seamless experience for both medical professionals and patients through our mobile, virtual and in-person services.. . The Job at a Glance. . Be part of Carbon Health’s dynamic and talented Data Science organization!. . Our Data Science team provides the Carbon Health modern tech-enable health care platform that combines technology with inviting healthcare clinics designed from the ground up, putting patient care first.. . As a Data Scientist at Carbon Health, you will collaborate with us to deliver high impact data products, drive actions by providing visibility into the state of care and operations, and implement and evangelize reliable data processing and interpretation practices.. . In this role, you will collaborate closely with our colleagues in Engineering, Product, Design, Support, Clinic Operations, Account Partnerships, Real Estate, Billing, Finance, and Marketing.. What You'll Do. Research and implement a suite of location intelligence tools. Assess and build wait time estimation and capacity planning models. Develop the data warehouse to reduce query complexity and enable access. Identify and implement improvements to the Clinical Decision Support System. Build timeseries models for forecasting, change, and anomaly detection use cases. Design and deliver metrics that define excellence in primary, urgent, and virtual care. Conduct analyses to drive improvements in the patient and provider apps and to support operational efficiency and new initiatives. Communicate results of analyses in a clear and actionable way to stakeholders. Support the hiring, mentorship, and retention of Data Scientists at the company. About You. Graduate degree, or equivalent experience in a quantitative field. Skilled in data processing with Python, Pandas, and SQL. Experienced in machine learning, and statistical methods with Spark, and Python. Experience in healthcare analytics, location analytics, and capacity planning. Perks. Forward-thinking, transparent, and inclusive company culture. Collaborative environment within and across our clinic sites and at HQ in San Francisco. Pre-tax benefits including Commuter (transit & parking), FSA Medical and FSA Dependent Care. 401K with matching contribution. Competitive compensation with medical, dental, vision, 401K (with match) and other great benefits for full time & part time employees who work 20+ hours a week. A BRIEF HISTORY. . Carbon Health is the technology-enabled healthcare provider designed from the ground up to put patient care first. By combining technology with modern clinics, it delivers a uniquely seamless experience from virtual care to in-person care to meet patients where they are. Carbon Health removes the boundaries to high-quality, transparent and personal care and envisions making patient-centric, world-class care accessible and a reality for everyone. Carbon Health is headquartered in San Francisco with clinics across California, Washington, New York and virtual care in 16 states across the U.S.. . To learn more about Carbon Health, and to stay up to date on what we're doing visit https://blog.carbonhealth.com/. . We here at Carbon Health recognize that the key to success lies in valuing the minds, experiences and perspectives of people from all walks of life. Carbon Health is proud to value diversity and be an equal employment opportunity employer. Pursuant to the San Francisco Fair Chance Ordinance and the Los Angeles Fair Chance Initiative for Hiring, we will consider for employment qualified applicants with arrest and conviction records.","['equal employment opportunity employer', 'envisions making patient-centric', 'anomaly detection use cases', 'world-class care accessible', 'deliver high impact data products', 'technology-enabled healthcare provider designed', 'making world-class care accessible', 'san francisco fair chance ordinance', 'pre-tax benefits including commuter', 'los angeles fair chance initiative']"
Senior Data Scientist (Remote/Virtual),"San Francisco Bay Area, CA",Boomi,,"Position Overview:. Are you looking for a one-of-a-kind opportunity and ready to work on world changing technologies? Are you passionate about analytics and knowledgeable about the supporting platforms that enable analytic solutions? How about building the next generation of the industry’s #1 Integration Platform as-a Service? At Dell Boomi, our vision is to harness the power of metadata by capturing the relationships and behaviors of applications and their interactions to reimagine and reinvent the customer experience.. We are looking for data scientists to drive machine learning, data mining, and statistical modeling for predictive and prescriptive enterprise analytics, and to join a talented, fast growing, driven team playing a key role in Boomi’s future initiatives. Successful candidates will be expected to understand data preparation needs and investigate state of the art techniques in advanced machine learning and statistical modeling, and also design, develop, and deploy state-of-the-art, scalable systems for innovative analytics applications. Applicants will be expected to work with a diverse, large set of data sources to find opportunities for product and process optimization and using models to test the effectiveness of different courses of action. They must have experience using a variety of data mining/data analysis methods, using a variety of data tools, building and implementing models, using/creating algorithms and creating/running simulations. They must have a proven ability to drive business results with their data-based insights.. Key Responsibilities:. Research, design, prototype and deliver robust and scalable models based on machine learning, data mining, and statistical modeling to answer key business problems, to improve the product, to increase and optimize customer experiences, and other business outcomes. Build cost effective tools and support structures needed to examine the data, perform elements of data cleaning, feature selection and feature engineering and organize experiments in conjunction with best practices. Work with development teams & business groups to ensure models can be implemented as part of a delivered solution replicable across many clients. Present findings to stakeholders to drive improvements and solutions from concept through to delivery. Keep abreast of the latest developments in the field by continuous learning and proactively champion promising new methods relevant to the problems at hand. Collaborate closely with university partners and other scientists and engineers in a multidisciplinary work environment. Prepare reports for executive team that effectively communicate trends, patterns, and predictions using relevant data.. Strong skills in software prototyping and engineering with expertise in applicable programming and analytics languages (Python, or R) and various open source machine learning and analytics packages to generate deliverable modules and prototype demonstrations of their work. Ability and inclination to work in multi-disciplinary environments, and a passion for ideas realized in practice and a demonstrated ability to propose novel solutions to problems, performing experiments to show the feasibility of their solutions, and working to refine the solutions into a real-world context. Required Qualifications:. Bachelors in computer science or a related field with 3+ years of experience in data modeling, business intelligence.. Knowledge of a variety of machine learning techniques (clustering, decision tree learning, artificial neural networks, etc.) and their real-world advantages/drawbacks. Ability to scale production ready models and have a demonstrated history of developing and delivering analytics models and solutions. Deep knowledge of fundamentals of machine learning, data mining and statistical predictive modeling, and extensive experience applying these methods to real world problems. Experience working with and creating data architectures.. AWS experience. Preferred Skills:. Java knowledge is a plus. Dell Technologies is a unique family of businesses that helps organizations and individuals build their digital future and transform how they work, live and play—providing customers with the industry’s broadest and most innovative technology and services portfolio. We value our customers, winning together, innovation, results and integrity. Grow your career with a generous salary, bonus programs, world-class benefits and unparalleled learning and development opportunities— all at a company that is proud to be diverse and inclusive. Learn more on how we are closing the diversity gap here.. Dell is committed to the value of equal employment opportunity for all employees and to providing employees with a work environment free of discrimination and harassment. All employment decisions at Dell are based on business needs, job requirements and individual qualifications, without regard to race, color, religion or belief, national, social or ethnic origin, sex (including pregnancy), age, physical, mental or sensory disability, HIV Status, sexual orientation, gender identity and/or expression, marital, civil union or domestic partnership status, past or present military service, family medical history or genetic information, family or parental status, or any other status protected by the laws or regulations in the locations where we operate. Dell will not tolerate discrimination or harassment based on any of these characteristics. Dell encourages applicants of all ages. Read the full Employment Opportunity Policy here.. Job ID: R076154","['scale production ready models', 'understand data preparation needs', 'development teams & business groups', 'build cost effective tools', 'real-world advantages/drawbacks', 'full employment opportunity policy', 'data mining/data analysis methods', 'various open source machine learning', 'deploy state-of-the-art', 'one-of-a-kind opportunity']"
Staff Data Scientist- Consumer Product- Health Team,"San Francisco, CA",Twitter,,"Company Description. . null. . Job Description. . Defending the health and integrity of the public conversation is Twitter’s top priority. The Health Data Science Team partners with Product, Engineering, and Policy to rigorously understand and quantify Twitter's highly complex and adversarial Health space and use this understanding to empower the Health Organization to better protect our users.. As a Staff Data Scientist on the Health Data Science Team you will:. Leverage data to identify unwanted interactions, violations of Twitter’s policies, misinformation, and other platform abuse then mitigate those issues with models or quantitatively driven product changes.. Design, implement, and analyze experiments to determine how new models or products improve the health of the platform.. Conduct analyses to better understand the determinants of the health and integrity on Twitter. Use this understanding to suggest product improvements.. Create accurate and statistically sound summary metrics to evaluate the performance of Health related products and motivate teams’ targets/KRs.. Communicate findings to executives and cross-functional teams.. Review other data scientists’ code and results to foster a culture of rigorous analysis and constructive feedback.. Help set the team direction by driving cross-functional alignment on projects and priorities.. . Qualifications. . What it takes. Advanced degree in a discipline that uses statistical analysis or mathematical modeling and 4+ years of work experience (or 7+ years of total work experience).. Experience measuring and mitigating consumer products’ vulnerability to manipulation and subversion.. Experience with one or more of the following in an applied business setting: experimental design and analysis, quasi-experimental analysis, and machine learning.. Track record for executing projects and leading complex, multi-functional projects with several dependencies, including Legal and Policy teams.. Strong proficiency with Python / R and SQL; familiarity with Spark.. Experience mentoring junior data scientists.. Additional Information. . We are committed to an inclusive and diverse Twitter. Twitter is an equal opportunity employer. We do not discriminate based on race, ethnicity, color, ancestry, national origin, religion, sex, sexual orientation, gender identity, age, disability, veteran, genetic information, marital status or any other legally protected status.. San Francisco applicants: Pursuant to the San Francisco Fair Chance Ordinance, we will consider for employment qualified applicants with arrest and conviction records.","['cross-functional teams', 'staff data scientist', 'san francisco applicants', 'health data science team', 'quantitatively driven product changes', 'driving cross-functional alignment', 'statistically sound summary metrics', 'health data science team partners', 'experience mentoring junior data scientists', 'san francisco fair chance ordinance']"
